{
  "format": "scene-format",
  "version": "1.0",
  "id": "scene-player-core-demo.ja",
  "workId": "scene-player-core-demo",
  "language": "ja",
  "title": "次の文章は、まだ見えない。",
  "author": "Scene Studio",
  "theme": "light",
  "scenes": [
    {"id":"s001","type":"text","text":"文章は、最初から全部見えていなくてもいい。","pause":2200},
    {"id":"s002","type":"text","text":"自分の操作で、次のSceneが現れる。","subText":"TAP / AUTO","pause":2400,"presentation":{"effect":"fade"}},
    {"id":"s003","type":"dialogue","text":"次は、まだ見えない。","pause":2100,"presentation":{"display":"solo","effect":"whisper"}},
    {"id":"s004","type":"text","text":"でも、過去には戻れる。","subText":"‹ ボタン / 上・右スワイプ / ↑ ← キー","pause":2400},
    {"id":"s005","type":"text","text":"Scene Player Core v1","subText":"Scene Format v1.0 を読むための、最初の共通Core。","pause":2800,"presentation":{"effect":"pop"}}
  ]
}
